code,name,status,codeforiati:category-code,codeforiati:group-code,codeforiati:category-name,codeforiati:group-name
11110,Política e gestão administrativa da educação,active,111,110,"Educação, nível não especificado",Educação
11120,Instalações de educação e formação,active,111,110,"Educação, nível não especificado",Educação
11130,Formação de professores,active,111,110,"Educação, nível não especificado",Educação
11182,Investigação educativa,active,111,110,"Educação, nível não especificado",Educação
11220,Ensino primário,active,112,110,Ensino básico,Educação
11230,Competências básicas de vida para adultos,active,112,110,Ensino básico,Educação
11231,Competências básicas de vida para jovens,active,112,110,Ensino básico,Educação
11232,Ensino primário equivalente para adultos,active,112,110,Ensino básico,Educação
11240,Educação na primeira infância,active,112,110,Ensino básico,Educação
11250,Alimentação escolar,active,112,110,Ensino básico,Educação
11260,Primeiro ciclo do ensino secundário,active,112,110,Ensino básico,Educação
11320,Segundo ciclo do ensino secundário (modificado e inclui dados do 11322),active,113,110,Ensino secundário,Educação
11330,Formação profissional,active,113,110,Ensino secundário,Educação
11420,Ensino superior,active,114,110,Ensino pós-secundário,Educação
11430,Formação técnica e de gestão avançada,active,114,110,Ensino pós-secundário,Educação
12110,Política e gestão administrativa da saúde,active,121,120,"Saúde, geral",Saúde
12181,Educação/formação médica,active,121,120,"Saúde, geral",Saúde
12182,Investigação médica,active,121,120,"Saúde, geral",Saúde
12191,Serviços médicos,active,121,120,"Saúde, geral",Saúde
12220,Cuidados de saúde básica,active,122,120,Saúde básica,Saúde
12230,Infraestruturas básicas de saúde,active,122,120,Saúde básica,Saúde
12240,Nutrição Básica,active,122,120,Saúde básica,Saúde
12250,Controle de doenças infecciosas,active,122,120,Saúde básica,Saúde
12261,Educação sanitária,active,122,120,Saúde básica,Saúde
12262,Controle da malária,active,122,120,Saúde básica,Saúde
12263,Controle da tuberculose,active,122,120,Saúde básica,Saúde
12264,,active,122,120,Saúde básica,Saúde
12281,Desenvolvimento do pessoal de saúde,active,122,120,Saúde básica,Saúde
12310,"Controle de DNT, geral",active,123,120,Doenças não transmissíveis (DNT),Saúde
12320,Controle do tabagismo,active,123,120,Doenças não transmissíveis (DNT),Saúde
12330,Controle do consumo nocivo de bebidas alcoólicas e drogas,active,123,120,Doenças não transmissíveis (DNT),Saúde
12340,Promoção da saúde mental e do bem-estar,active,123,120,Doenças não transmissíveis (DNT),Saúde
12350,Outros meios de prevenção e tratamento de DNT,active,123,120,Doenças não transmissíveis (DNT),Saúde
12382,Investigação para prevenção e controle de DNT,active,123,120,Doenças não transmissíveis (DNT),Saúde
13010,Política e gestão administrativa da população,active,130,130,Políticas/programas populacionais e saúde reprodutiva,Políticas/programas populacionais e saúde reprodutiva
13020,Cuidados para a saúde reprodutiva,active,130,130,Políticas/programas populacionais e saúde reprodutiva,Políticas/programas populacionais e saúde reprodutiva
13030,Planejamento familiar,active,130,130,Políticas/programas populacionais e saúde reprodutiva,Políticas/programas populacionais e saúde reprodutiva
13040,"Controle de DST, incluindo o HIV/AIDS",active,130,130,Políticas/programas populacionais e saúde reprodutiva,Políticas/programas populacionais e saúde reprodutiva
13081,Desenvolvimento de pessoal para a população e a saúde reprodutiva,active,130,130,Políticas/programas populacionais e saúde reprodutiva,Políticas/programas populacionais e saúde reprodutiva
14010,Política e gestão administrativa do setor da água,active,140,140,Abastecimento de água e saneamento,Abastecimento de água e saneamento
14015,Conservação de recursos hídricos (incluindo recolha de dados),active,140,140,Abastecimento de água e saneamento,Abastecimento de água e saneamento
14020,Abastecimento de água e saneamento – sistemas de grande escala,active,140,140,Abastecimento de água e saneamento,Abastecimento de água e saneamento
14021,Abastecimento de água – sistemas de grande escala,active,140,140,Abastecimento de água e saneamento,Abastecimento de água e saneamento
14022,Saneamento – sistemas de grande escala,active,140,140,Abastecimento de água e saneamento,Abastecimento de água e saneamento
14030,Abastecimento básico de água potável e saneamento básico,active,140,140,Abastecimento de água e saneamento,Abastecimento de água e saneamento
14031,Abastecimento básico de água potável,active,140,140,Abastecimento de água e saneamento,Abastecimento de água e saneamento
14032,Saneamento básico,active,140,140,Abastecimento de água e saneamento,Abastecimento de água e saneamento
14040,Desenvolvimento de bacias fluviais,active,140,140,Abastecimento de água e saneamento,Abastecimento de água e saneamento
14050,Gestão/escoamento da água,active,140,140,Abastecimento de água e saneamento,Abastecimento de água e saneamento
14081,Educação e formação sobre abastecimento de água e saneamento,active,140,140,Abastecimento de água e saneamento,Abastecimento de água e saneamento
15110,Política e gestão administrativa do setor público,active,151,150,"Governo e sociedade civil, geral",Governo e sociedade civil
15111,Gestão das finanças públicas (GFP),active,151,150,"Governo e sociedade civil, geral",Governo e sociedade civil
15112,Descentralização e apoio à administração pública subnacional,active,151,150,"Governo e sociedade civil, geral",Governo e sociedade civil
15113,Organizações e instituições de combate à corrupção,active,151,150,"Governo e sociedade civil, geral",Governo e sociedade civil
15114,Mobilização de receitas internas,active,151,150,"Governo e sociedade civil, geral",Governo e sociedade civil
15125,Contratação pública,active,151,150,"Governo e sociedade civil, geral",Governo e sociedade civil
15130,Desenvolvimento jurídico e judicial,active,151,150,"Governo e sociedade civil, geral",Governo e sociedade civil
15142,Política macroeconómica,active,151,150,"Governo e sociedade civil, geral",Governo e sociedade civil
15150,Participação democrática e sociedade civil,active,151,150,"Governo e sociedade civil, geral",Governo e sociedade civil
15151,Eleições,active,151,150,"Governo e sociedade civil, geral",Governo e sociedade civil
15152,Legislaturas e partidos políticos,active,151,150,"Governo e sociedade civil, geral",Governo e sociedade civil
15153,Meios de comunicação e livre circulação da informação,active,151,150,"Governo e sociedade civil, geral",Governo e sociedade civil
15160,Direitos humanos,active,151,150,"Governo e sociedade civil, geral",Governo e sociedade civil
15170,"Organizações, movimentos e instituições governamentais de direitos da mulher",active,151,150,"Governo e sociedade civil, geral",Governo e sociedade civil
15180,Erradicação da violência contra as mulheres e raparigas,active,151,150,"Governo e sociedade civil, geral",Governo e sociedade civil
15190,"Facilitação da migração e da mobilidade ordenadas, seguras, regulares e responsáveis",active,151,150,"Governo e sociedade civil, geral",Governo e sociedade civil
15210,Gestão e reforma do sistema de segurança,active,152,150,"Conflitos, paz e segurança",Governo e sociedade civil
15220,"Consolidação da paz civil, prevenção e resolução de conflitos",active,152,150,"Conflitos, paz e segurança",Governo e sociedade civil
15230,Participação em operações internacionais de consolidação da paz,active,152,150,"Conflitos, paz e segurança",Governo e sociedade civil
15240,Reintegração e controle de armas leves e de pequeno calibre,active,152,150,"Conflitos, paz e segurança",Governo e sociedade civil
15250,Remoção de minas terrestres e explosivos remanescentes de guerra,active,152,150,"Conflitos, paz e segurança",Governo e sociedade civil
15261,Crianças-soldado (prevenção e desmobilização),active,152,150,"Conflitos, paz e segurança",Governo e sociedade civil
16010,Proteção social,active,160,160,Outros serviços e infraestruturas sociais,Outros serviços e infraestruturas sociais
16020,Criação de emprego,active,160,160,Outros serviços e infraestruturas sociais,Outros serviços e infraestruturas sociais
16030,Política e gestão administrativa da habitação,active,160,160,Outros serviços e infraestruturas sociais,Outros serviços e infraestruturas sociais
16040,Habitação de baixo custo,active,160,160,Outros serviços e infraestruturas sociais,Outros serviços e infraestruturas sociais
16050,Ajuda multissetorial para serviços sociais básicos,active,160,160,Outros serviços e infraestruturas sociais,Outros serviços e infraestruturas sociais
16061,Cultura e lazer,active,160,160,Outros serviços e infraestruturas sociais,Outros serviços e infraestruturas sociais
16062,Reforço da capacidade estatística,active,160,160,Outros serviços e infraestruturas sociais,Outros serviços e infraestruturas sociais
16063,Controle de narcóticos,active,160,160,Outros serviços e infraestruturas sociais,Outros serviços e infraestruturas sociais
16064,Mitigação social do HIV/AIDS,active,160,160,Outros serviços e infraestruturas sociais,Outros serviços e infraestruturas sociais
16070,Direitos laborais,active,160,160,Outros serviços e infraestruturas sociais,Outros serviços e infraestruturas sociais
16080,Diálogo social,active,160,160,Outros serviços e infraestruturas sociais,Outros serviços e infraestruturas sociais
21010,Política e gestão administrativa dos transportes,active,210,210,Transportes e armazenamento,Transportes e armazenamento
21020,Transporte rodoviário,active,210,210,Transportes e armazenamento,Transportes e armazenamento
21030,Transporte ferroviário,active,210,210,Transportes e armazenamento,Transportes e armazenamento
21040,Transporte hidroviário,active,210,210,Transportes e armazenamento,Transportes e armazenamento
21050,Transporte aéreo,active,210,210,Transportes e armazenamento,Transportes e armazenamento
21061,Armazenamento,active,210,210,Transportes e armazenamento,Transportes e armazenamento
21081,Educação e formação sobre transporte e armazenamento,active,210,210,Transportes e armazenamento,Transportes e armazenamento
22010,Política e gestão administrativa das comunicações,active,220,220,Comunicações,Comunicações
22020,Telecomunicações,active,220,220,Comunicações,Comunicações
22030,Rádio/televisão/imprensa escrita,active,220,220,Comunicações,Comunicações
22040,Tecnologias de informação e comunicação (TIC),active,220,220,Comunicações,Comunicações
23110,Política e gestão administrativa da energia,active,231,230,Política energética,Energia
23181,Educação/formação sobre energia,active,231,230,Política energética,Energia
23182,Investigação sobre energia,active,231,230,Política energética,Energia
23183,Conservação de energia e eficiência do lado da procura,active,231,230,Política energética,Energia
23210,"Geração de energia, fontes renováveis ​​– várias tecnologias",active,232,230,"Geração de energia, fontes renováveis",Energia
23220,Centrais de energia hidroelétricas,active,232,230,"Geração de energia, fontes renováveis",Energia
23230,Energia solar para redes centralizadas,active,232,230,"Geração de energia, fontes renováveis",Energia
23231,Energia solar para redes isoladas e sistemas autônomos,active,232,230,"Geração de energia, fontes renováveis",Energia
23232,Energia solar – aplicações térmicas,active,232,230,"Geração de energia, fontes renováveis",Energia
23240,Energia eólica,active,232,230,"Geração de energia, fontes renováveis",Energia
23250,Energia marítima,active,232,230,"Geração de energia, fontes renováveis",Energia
23260,Energia geotérmica,active,232,230,"Geração de energia, fontes renováveis",Energia
23270,Centrais de energia elétricas alimentadas a biocombustível,active,232,230,"Geração de energia, fontes renováveis",Energia
23310,"Geração de energia, fontes não renováveis, não especificadas",active,233,230,"Geração de energia, fontes não renováveis",Energia
23320,Centrais de energia elétricas alimentadas a carvão,active,233,230,"Geração de energia, fontes não renováveis",Energia
23330,Centrais de energia elétricas alimentadas a petróleo,active,233,230,"Geração de energia, fontes não renováveis",Energia
23340,Centrais de energia elétricas alimentadas a gás natural,active,233,230,"Geração de energia, fontes não renováveis",Energia
23350,Centrais de energia elétricas alimentadas a combustíveis fósseis com captura e armazenamento de carbono (CAC),active,233,230,"Geração de energia, fontes não renováveis",Energia
23360,Centrais de energia elétricas alimentadas a resíduos não renováveis,active,233,230,"Geração de energia, fontes não renováveis",Energia
23410,Centrais de energia elétricas de energia híbrida,active,234,230,Centrais de energia híbridas,Energia
23510,Centrais de energia nucleares e segurança nuclear,active,235,230,Centrais de energia nuclear,Energia
23610,Centrais de aquecimento,active,236,230,Distribuição de energia,Energia
23620,Aquecimento e refrigeração urbanos,active,236,230,Distribuição de energia,Energia
23630,Transmissão e distribuição de energia elétrica (redes centralizadas),active,236,230,Distribuição de energia,Energia
23631,Transmissão e distribuição de energia elétrica (minirredes isoladas),active,236,230,Distribuição de energia,Energia
23640,Distribuição de gás a retalho,active,236,230,Distribuição de energia,Energia
23641,Distribuição de combustíveis fósseis líquidos ou sólidos a retalho,active,236,230,Distribuição de energia,Energia
23642,Infraestruturas de mobilidade elétrica,active,236,230,Distribuição de energia,Energia
24010,Política e gestão administrativa da área financeira,active,240,240,Serviços bancários e financeiros,Serviços bancários e financeiros
24020,Instituições monetárias,active,240,240,Serviços bancários e financeiros,Serviços bancários e financeiros
24030,Intermediários financeios do setor formal,active,240,240,Serviços bancários e financeiros,Serviços bancários e financeiros
24040,Intermediários financeiros informais/semiformais,active,240,240,Serviços bancários e financeiros,Serviços bancários e financeiros
24050,"Facilitação, promoção e otimização de remessas monetárias",active,240,240,Serviços bancários e financeiros,Serviços bancários e financeiros
24081,Educação/formação sobre serviços bancários e financeiros,active,240,240,Serviços bancários e financeiros,Serviços bancários e financeiros
25010,Política e administração de negócios,active,250,250,Negócios e outros serviços,Negócios e outros serviços
25020,Privatização,active,250,250,Negócios e outros serviços,Negócios e outros serviços
25030,Serviços de desenvolvimento de negócios,active,250,250,Negócios e outros serviços,Negócios e outros serviços
25040,Conduta empresarial responsável,active,250,250,Negócios e outros serviços,Negócios e outros serviços
31110,Política e gestão administrativa da agricultura,active,311,310,Agricultura,"Agricultura, Silvicultura, Pesca"
31120,Desenvolvimento agrícola,active,311,310,Agricultura,"Agricultura, Silvicultura, Pesca"
31130,Recursos fundiários agrícolas,active,311,310,Agricultura,"Agricultura, Silvicultura, Pesca"
31140,Recursos hídricos agrícolas,active,311,310,Agricultura,"Agricultura, Silvicultura, Pesca"
31150,Insumos agrícolas,active,311,310,Agricultura,"Agricultura, Silvicultura, Pesca"
31161,Produção de culturas alimentares,active,311,310,Agricultura,"Agricultura, Silvicultura, Pesca"
31162,Culturas industriais/culturas para exportação,active,311,310,Agricultura,"Agricultura, Silvicultura, Pesca"
31163,Pecuária,active,311,310,Agricultura,"Agricultura, Silvicultura, Pesca"
31164,Reforma agrária,active,311,310,Agricultura,"Agricultura, Silvicultura, Pesca"
31165,Desenvolvimento de alternativas agrícolas,active,311,310,Agricultura,"Agricultura, Silvicultura, Pesca"
31166,Expansão agrícola,active,311,310,Agricultura,"Agricultura, Silvicultura, Pesca"
31181,Educação/formação sobre agricultura,active,311,310,Agricultura,"Agricultura, Silvicultura, Pesca"
31182,Investigação agrícola,active,311,310,Agricultura,"Agricultura, Silvicultura, Pesca"
31191,Serviços agrícolas,active,311,310,Agricultura,"Agricultura, Silvicultura, Pesca"
31192,Proteção e controle de pragas para plantas e pós-colheitas,active,311,310,Agricultura,"Agricultura, Silvicultura, Pesca"
31193,Serviços financeiros agrícolas,active,311,310,Agricultura,"Agricultura, Silvicultura, Pesca"
31194,Cooperativas agrícolas,active,311,310,Agricultura,"Agricultura, Silvicultura, Pesca"
31195,Serviços pecuários/veterinários,active,311,310,Agricultura,"Agricultura, Silvicultura, Pesca"
31210,Política e gestão administrativa da silvicultura,active,312,310,Silvicultura,"Agricultura, Silvicultura, Pesca"
31220,Desenvolvimento florestal,active,312,310,Silvicultura,"Agricultura, Silvicultura, Pesca"
31261,Lenha/carvão vegetal,active,312,310,Silvicultura,"Agricultura, Silvicultura, Pesca"
31281,Educação/formação sobre silvicultura,active,312,310,Silvicultura,"Agricultura, Silvicultura, Pesca"
31282,Investigação florestal,active,312,310,Silvicultura,"Agricultura, Silvicultura, Pesca"
31291,Serviços florestais,active,312,310,Silvicultura,"Agricultura, Silvicultura, Pesca"
31310,Política e gestão administrativa da pesca,active,313,310,Pesca,"Agricultura, Silvicultura, Pesca"
31320,Desenvolvimento da pesca,active,313,310,Pesca,"Agricultura, Silvicultura, Pesca"
31381,Educação/formação sobre pesca,active,313,310,Pesca,"Agricultura, Silvicultura, Pesca"
31382,Investigação sobre pesca,active,313,310,Pesca,"Agricultura, Silvicultura, Pesca"
31391,Serviços pesqueiros,active,313,310,Pesca,"Agricultura, Silvicultura, Pesca"
32110,Política e gestão administrativa da indústria,active,321,320,Indústria,"Indústria, extractivas, construção"
32120,Desenvolvimento industrial,active,321,320,Indústria,"Indústria, extractivas, construção"
32130,Desenvolvimento de pequenas e médias empresas (PME),active,321,320,Indústria,"Indústria, extractivas, construção"
32140,Indústrias caseiras e artesanato,active,321,320,Indústria,"Indústria, extractivas, construção"
32161,Agroindústrias,active,321,320,Indústria,"Indústria, extractivas, construção"
32162,Indústrias florestais,active,321,320,Indústria,"Indústria, extractivas, construção"
32163,"Têxteis, couros e substitutos",active,321,320,Indústria,"Indústria, extractivas, construção"
32164,Produtos químicos,active,321,320,Indústria,"Indústria, extractivas, construção"
32165,Fábricas de fertilizantes,active,321,320,Indústria,"Indústria, extractivas, construção"
32166,Cimento/cal/gesso,active,321,320,Indústria,"Indústria, extractivas, construção"
32167,Indústria da energia (combustíveis fósseis),active,321,320,Indústria,"Indústria, extractivas, construção"
32168,Produção farmacêutica,active,321,320,Indústria,"Indústria, extractivas, construção"
32169,Indústrias de metais básicos,active,321,320,Indústria,"Indústria, extractivas, construção"
32170,Indústrias de metais não ferrosos,active,321,320,Indústria,"Indústria, extractivas, construção"
32171,Engenharia,active,321,320,Indústria,"Indústria, extractivas, construção"
32172,Indústria de equipamento de transporte,active,321,320,Indústria,"Indústria, extractivas, construção"
32173,Fabricação de biocombustíveis modernos,active,321,320,Indústria,"Indústria, extractivas, construção"
32174,Fabricação de aparelhos domésticos para a cozinha ecológica,active,321,320,Indústria,"Indústria, extractivas, construção"
32182,Investigação e desenvolvimento tecnológicos,active,321,320,Indústria,"Indústria, extractivas, construção"
32210,Política e gestão administrativa dos minerais/minas,active,322,320,Recursos minerais e mineração,"Indústria, extractivas, construção"
32220,Prospecção e exploração mineral,active,322,320,Recursos minerais e mineração,"Indústria, extractivas, construção"
32261,Carvão,active,322,320,Recursos minerais e mineração,"Indústria, extractivas, construção"
32262,Petróleo e gás (montante),active,322,320,Recursos minerais e mineração,"Indústria, extractivas, construção"
32263,Metais ferrosos,active,322,320,Recursos minerais e mineração,"Indústria, extractivas, construção"
32264,Metais não ferrosos,active,322,320,Recursos minerais e mineração,"Indústria, extractivas, construção"
32265,Metais/materiais preciosos,active,322,320,Recursos minerais e mineração,"Indústria, extractivas, construção"
32266,Minerais industriais,active,322,320,Recursos minerais e mineração,"Indústria, extractivas, construção"
32267,Minerais fertilizantes,active,322,320,Recursos minerais e mineração,"Indústria, extractivas, construção"
32268,Minerais dos fundos marinhos,active,322,320,Recursos minerais e mineração,"Indústria, extractivas, construção"
32310,Política e gestão administrativa da construção,active,323,320,Construção,"Indústria, extractivas, construção"
33110,Política e gestão administrativa do comércio,active,331,331,Políticas comerciais e regulamentos,Políticas comerciais e regulamentos
33120,Facilitação do comércio,active,331,331,Políticas comerciais e regulamentos,Políticas comerciais e regulamentos
33130,Acordos de comércio regional (ACR),active,331,331,Políticas comerciais e regulamentos,Políticas comerciais e regulamentos
33140,Negociações comerciais multilaterais,active,331,331,Políticas comerciais e regulamentos,Políticas comerciais e regulamentos
33150,Ajustes relacionados ao comércio,active,331,331,Políticas comerciais e regulamentos,Políticas comerciais e regulamentos
33181,Educação/formação sobre comércio,active,331,331,Políticas comerciais e regulamentos,Políticas comerciais e regulamentos
33210,Política e gestão administrativa do turismo,active,332,332,Turismo,Turismo
41010,Política e gestão administrativa do ambiente,active,410,410,Proteção geral do ambiente,Proteção geral do ambiente
41020,Proteção da biosfera,active,410,410,Proteção geral do ambiente,Proteção geral do ambiente
41030,Biodiversidade,active,410,410,Proteção geral do ambiente,Proteção geral do ambiente
41040,Preservação da paisagem,active,410,410,Proteção geral do ambiente,Proteção geral do ambiente
41081,Educação/formação sobre ambiente,active,410,410,Proteção geral do ambiente,Proteção geral do ambiente
41082,Investigação ambiental,active,410,410,Proteção geral do ambiente,Proteção geral do ambiente
43010,Ajuda multissetorial,active,430,430,"Outros, multissetoriais","Outros, multissetoriais"
43030,Desenvolvimento e gestão urbanos,active,430,430,"Outros, multissetoriais","Outros, multissetoriais"
43040,Desenvolvimento rural,active,430,430,"Outros, multissetoriais","Outros, multissetoriais"
43050,Desenvolvimento de alternativas não agrícolas,active,430,430,"Outros, multissetoriais","Outros, multissetoriais"
43060,Redução do risco de catástrofes,active,430,430,"Outros, multissetoriais","Outros, multissetoriais"
43071,Política e gestão administrativa da segurança alimentar,active,430,430,"Outros, multissetoriais","Outros, multissetoriais"
43072,Programas de segurança alimentar doméstica,active,430,430,"Outros, multissetoriais","Outros, multissetoriais"
43073,Segurança e qualidade alimentares,active,430,430,"Outros, multissetoriais","Outros, multissetoriais"
43081,Educação/formação multissetorial,active,430,430,"Outros, multissetoriais","Outros, multissetoriais"
43082,Instituições científicas/de investigação,active,430,430,"Outros, multissetoriais","Outros, multissetoriais"
51010,Ajuda relacionada com o apoio orçamental geral,active,510,510,Apoio orçamental geral,Apoio orçamental geral
52010,Assistência alimentar,active,520,520,Ajuda alimentar ao desenvolvimento,Ajuda alimentar ao desenvolvimento
53030,Apoio à importação (bens de capital),active,530,530,Outra ajuda por meio de mercadorias,Outra ajuda por meio de mercadorias
53040,Apoio à importação (mercadorias),active,530,530,Outra ajuda por meio de mercadorias,Outra ajuda por meio de mercadorias
60010,Ação relacionada com a dívida,active,600,600,Ação relacionada com a dívida,Ação relacionada com a dívida
60020,Perdão de dívida,active,600,600,Ação relacionada com a dívida,Ação relacionada com a dívida
60030,Alívio da dívida multilateral,active,600,600,Ação relacionada com a dívida,Ação relacionada com a dívida
60040,Reescalonamento e refinanciamento,active,600,600,Ação relacionada com a dívida,Ação relacionada com a dívida
60061,Permuta de dívida por desenvolvimento,active,600,600,Ação relacionada com a dívida,Ação relacionada com a dívida
60062,Outras permutas de dívida,active,600,600,Ação relacionada com a dívida,Ação relacionada com a dívida
60063,Recompra de dívida,active,600,600,Ação relacionada com a dívida,Ação relacionada com a dívida
72010,Assistência e serviços de alívio material,active,720,720,Resposta de emergência,Resposta de emergência
