code,name,status,codeforiati:category-code,codeforiati:group-code,codeforiati:category-name,codeforiati:group-name
72040,Assistência alimentar de emergência,active,720,720,Resposta de emergência,Resposta de emergência
72050,Serviços de coordenação e apoio ao alívio,active,720,720,Resposta de emergência,Resposta de emergência
73010,Reconstrução e reabilitação pós-emergência imediatas,active,730,730,Ajuda à reconstrução e reabilitação,Ajuda à reconstrução e reabilitação
74020,Preparação da resposta contra vários riscos,active,740,740,Prevenção e preparação contra catástrofes,Prevenção e preparação contra catástrofes
91010,Custos administrativos (não atribuíveis a setores),active,910,910,Custos administrativos dos doadores,Custos administrativos dos doadores
93010,Refugiados/requerentes de asilo em países doadores (não atribuíveis a setores),active,930,930,Refugiados em países doadores,Refugiados em países doadores
99810,Setores não especificados,active,998,998,Não atribuído/não especificado,Não atribuído/não especificado
99820,Promoção da conscientização sobre o desenvolvimento (não atribuíveis a setores),active,998,998,Não atribuído/não especificado,Não atribuído/não especificado
