code,name,status,codeforiati:group-name,codeforiati:category-name,codeforiati:category-code,codeforiati:group-code
52010,Assistance alimentaire,active,Aide Alimentaire Dévelopmentale,Aide Alimentaire Dévelopmentale,520,520
53030,Subventions à l'importation (biens d'équipement),active,"Aide sous forme de Produits, Autre","Aide sous forme de Produits, Autre",530,530
53040,Subventions à l'importation (produits),active,"Aide sous forme de Produits, Autre","Aide sous forme de Produits, Autre",530,530
60010,Actions se rapportant à la dette,active,Actions se Rapportant a la Dette,Actions se Rapportant a la Dette,600,600
60020,Annulation de la dette,active,Actions se Rapportant a la Dette,Actions se Rapportant a la Dette,600,600
60030,Allégement de la dette multilatérale,active,Actions se Rapportant a la Dette,Actions se Rapportant a la Dette,600,600
60040,Rééchelonnement d'échéances et refinancement,active,Actions se Rapportant a la Dette,Actions se Rapportant a la Dette,600,600
60061,Echange de dette à des fins de développement,active,Actions se Rapportant a la Dette,Actions se Rapportant a la Dette,600,600
60062,Autres échanges de dette,active,Actions se Rapportant a la Dette,Actions se Rapportant a la Dette,600,600
60063,Rachat de la dette,active,Actions se Rapportant a la Dette,Actions se Rapportant a la Dette,600,600
72010,Assistance matérielle et services d'urgence,active,Intervention d'Urgence,Intervention d'Urgence,720,720
72040,Assistance alimentaire d'urgence,active,Intervention d'Urgence,Intervention d'Urgence,720,720
72050,Coordination des secours et services de soutien,active,Intervention d'Urgence,Intervention d'Urgence,720,720
73010,Reconstruction et réhabilitation immédiate post-urgence,active,Reconstruction & Réhabilitation,Reconstruction & Réhabilitation,730,730
74020,Préparation aux interventions multi-risques,active,Prévention catastrophes/Préparation à leur survenue,Prévention catastrophes/Préparation à leur survenue,740,740
91010,Frais administratifs (non alloués par secteur),active,Frais Administratifs des Donneurs,Frais Administratifs des Donneurs,910,910
93010,Refugiés/demandeurs d'asile dans les pays donneurs (non alloués),active,Refugiés dans les Pays Donneurs,Refugiés dans les Pays Donneurs,930,930
99810,Secteur non spécifié,active,Non Affecté / Non Specifié,Non Affecté / Non Specifié,998,998
99820,Sensibilisation au développement (non alloués par secteur),active,Non Affecté / Non Specifié,Non Affecté / Non Specifié,998,998
