code,name,status,codeforiati:group-name,codeforiati:group-code,codeforiati:category-code,codeforiati:category-name
72040,Assistência alimentar de emergência,active,Resposta de emergência,720,720,Resposta de emergência
72050,Serviços de coordenação e apoio ao alívio,active,Resposta de emergência,720,720,Resposta de emergência
73010,Reconstrução e reabilitação pós-emergência imediatas,active,Ajuda à reconstrução e reabilitação,730,730,Ajuda à reconstrução e reabilitação
74020,Preparação da resposta contra vários riscos,active,Prevenção e preparação contra catástrofes,740,740,Prevenção e preparação contra catástrofes
91010,Custos administrativos (não atribuíveis a setores),active,Custos administrativos dos doadores,910,910,Custos administrativos dos doadores
93010,Refugiados/requerentes de asilo em países doadores (não atribuíveis a setores),active,Refugiados em países doadores,930,930,Refugiados em países doadores
99810,Setores não especificados,active,Não atribuído/não especificado,998,998,Não atribuído/não especificado
99820,Promoção da conscientização sobre o desenvolvimento (não atribuíveis a setores),active,Não atribuído/não especificado,998,998,Não atribuído/não especificado
