code,name,status,codeforiati:category-code,codeforiati:category-name,codeforiati:group-code,codeforiati:group-name
52010,Assistance alimentaire,active,520,Aide Alimentaire Dévelopmentale,520,Aide Alimentaire Dévelopmentale
53030,Subventions à l'importation (biens d'équipement),active,530,"Aide sous forme de Produits, Autre",530,"Aide sous forme de Produits, Autre"
53040,Subventions à l'importation (produits),active,530,"Aide sous forme de Produits, Autre",530,"Aide sous forme de Produits, Autre"
60010,Actions se rapportant à la dette,active,600,Actions se Rapportant a la Dette,600,Actions se Rapportant a la Dette
60020,Annulation de la dette,active,600,Actions se Rapportant a la Dette,600,Actions se Rapportant a la Dette
60030,Allégement de la dette multilatérale,active,600,Actions se Rapportant a la Dette,600,Actions se Rapportant a la Dette
60040,Rééchelonnement d'échéances et refinancement,active,600,Actions se Rapportant a la Dette,600,Actions se Rapportant a la Dette
60061,Echange de dette à des fins de développement,active,600,Actions se Rapportant a la Dette,600,Actions se Rapportant a la Dette
60062,Autres échanges de dette,active,600,Actions se Rapportant a la Dette,600,Actions se Rapportant a la Dette
60063,Rachat de la dette,active,600,Actions se Rapportant a la Dette,600,Actions se Rapportant a la Dette
72010,Assistance matérielle et services d'urgence,active,720,Intervention d'Urgence,720,Intervention d'Urgence
72040,Assistance alimentaire d'urgence,active,720,Intervention d'Urgence,720,Intervention d'Urgence
72050,Coordination des secours et services de soutien,active,720,Intervention d'Urgence,720,Intervention d'Urgence
73010,Reconstruction et réhabilitation immédiate post-urgence,active,730,Reconstruction & Réhabilitation,730,Reconstruction & Réhabilitation
74020,Préparation aux interventions multi-risques,active,740,Prévention catastrophes/Préparation à leur survenue,740,Prévention catastrophes/Préparation à leur survenue
91010,Frais administratifs (non alloués par secteur),active,910,Frais Administratifs des Donneurs,910,Frais Administratifs des Donneurs
93010,Refugiés/demandeurs d'asile dans les pays donneurs (non alloués),active,930,Refugiés dans les Pays Donneurs,930,Refugiés dans les Pays Donneurs
99810,Secteur non spécifié,active,998,Non Affecté / Non Specifié,998,Non Affecté / Non Specifié
99820,Sensibilisation au développement (non alloués par secteur),active,998,Non Affecté / Non Specifié,998,Non Affecté / Non Specifié
