code,name,status,codeforiati:category-name,codeforiati:category-code,codeforiati:group-code,codeforiati:group-name
11110,Gestión administrativa y políticas de la educación,active,"Educación, nivel no especificado",111,110,Educación
11120,Instalaciones educativas y capacitación,active,"Educación, nivel no especificado",111,110,Educación
11130,Capacitación de docentes,active,"Educación, nivel no especificado",111,110,Educación
11182,Investigación educativa,active,"Educación, nivel no especificado",111,110,Educación
11220,Educación primaria,active,Educación básica,112,110,Educación
11230,Competencias básicas para la vida dirigidas a adultos,active,Educación básica,112,110,Educación
11231,Competencias básicas para la vida dirigidas a jóvenes,active,Educación básica,112,110,Educación
11232,Equivalente a la educación primaria para adultos,active,Educación básica,112,110,Educación
11240,Educación de la primera infancia,active,Educación básica,112,110,Educación
11250,Alimentación escolar,active,Educación básica,112,110,Educación
11260,Educación secundaria inferior,active,Educación básica,112,110,Educación
11320,"Educación secundaria superior (modificada, incluye datos de 11322)",active,Educación secundaria,113,110,Educación
11330,Capacitación profesional,active,Educación secundaria,113,110,Educación
11420,Educación superior,active,Educación post-secundaria,114,110,Educación
11430,Capacitación técnica y administrativa avanzada,active,Educación post-secundaria,114,110,Educación
12110,Gestión administrativa y políticas de la salud,active,"Salud, general",121,120,Salud
12181,Educación o capacitación médica,active,"Salud, general",121,120,Salud
12182,Investigación médica,active,"Salud, general",121,120,Salud
12191,Servicios médicos,active,"Salud, general",121,120,Salud
12220,Atención sanitaria básica,active,Salud básica,122,120,Salud
12230,Infraestructura de la salud básica,active,Salud básica,122,120,Salud
12240,Nutrición básica,active,Salud básica,122,120,Salud
12250,Lucha contra las enfermedades infecciosas,active,Salud básica,122,120,Salud
12261,Educación sanitaria,active,Salud básica,122,120,Salud
12262,Lucha contra el paludismo,active,Salud básica,122,120,Salud
12263,Lucha contra tuberculosis,active,Salud básica,122,120,Salud
12264,,active,Salud básica,122,120,Salud
12281,Desarrollo del personal sanitario,active,Salud básica,122,120,Salud
12310,"Lucha contra enfermedades no transmisibles, general",active,Enfermedades no transmisibles,123,120,Salud
12320,Lucha contra el tabaquismo,active,Enfermedades no transmisibles,123,120,Salud
12330,Lucha contra el consumo nocivo de alcohol y drogas,active,Enfermedades no transmisibles,123,120,Salud
12340,Fomento de la salud y el bienestar mentales,active,Enfermedades no transmisibles,123,120,Salud
12350,Otro tipo de prevenciones y tratamientos de enfermedades no transmisibles,active,Enfermedades no transmisibles,123,120,Salud
12382,Investigación en prevención de y lucha contra enfermedades no transmisibles,active,Enfermedades no transmisibles,123,120,Salud
13010,Gestión administrativa y políticas en materia demográfica,active,Programas/políticas sobre población y salud reproductiva,130,130,Programas/políticas sobre población y salud reproductiva
13020,Atención de la salud reproductiva,active,Programas/políticas sobre población y salud reproductiva,130,130,Programas/políticas sobre población y salud reproductiva
13030,Planificación familiar,active,Programas/políticas sobre población y salud reproductiva,130,130,Programas/políticas sobre población y salud reproductiva
13040,"Lucha contra enfermedades de transmisión sexual, incluido el VIH/sida",active,Programas/políticas sobre población y salud reproductiva,130,130,Programas/políticas sobre población y salud reproductiva
13081,Desarrollo del personal de salud reproductiva y de la población,active,Programas/políticas sobre población y salud reproductiva,130,130,Programas/políticas sobre población y salud reproductiva
14010,Gestión administrativa y políticas del sector del agua,active,Abastecimiento de agua y saneamiento,140,140,Abastecimiento de agua y saneamiento
14015,Conservación de los recursos hídricos (incluida la recogida de datos),active,Abastecimiento de agua y saneamiento,140,140,Abastecimiento de agua y saneamiento
14020,Abastecimiento de agua y saneamiento: grandes sistemas,active,Abastecimiento de agua y saneamiento,140,140,Abastecimiento de agua y saneamiento
14021,Abastecimiento de agua: grandes sistemas,active,Abastecimiento de agua y saneamiento,140,140,Abastecimiento de agua y saneamiento
14022,Saneamiento: grandes sistemas,active,Abastecimiento de agua y saneamiento,140,140,Abastecimiento de agua y saneamiento
14030,Abastecimiento de agua potable y saneamiento básicos,active,Abastecimiento de agua y saneamiento,140,140,Abastecimiento de agua y saneamiento
14031,Abastecimiento básico de agua potable,active,Abastecimiento de agua y saneamiento,140,140,Abastecimiento de agua y saneamiento
14032,Saneamiento básico,active,Abastecimiento de agua y saneamiento,140,140,Abastecimiento de agua y saneamiento
14040,Desarrollo de cuencas fluviales,active,Abastecimiento de agua y saneamiento,140,140,Abastecimiento de agua y saneamiento
14050,Gestión y eliminación de residuos,active,Abastecimiento de agua y saneamiento,140,140,Abastecimiento de agua y saneamiento
14081,Educación y formación en abastecimiento de agua y saneamiento,active,Abastecimiento de agua y saneamiento,140,140,Abastecimiento de agua y saneamiento
15110,Gestión administrativa y políticas del sector público,active,"Gobierno y sociedad civil, general",151,150,Gobierno y sociedad civil
15111,Gestión financiera pública (GFP),active,"Gobierno y sociedad civil, general",151,150,Gobierno y sociedad civil
15112,Descentralización y apoyo a gobiernos subnacionales,active,"Gobierno y sociedad civil, general",151,150,Gobierno y sociedad civil
15113,Instituciones y organizaciones contra la corrupción,active,"Gobierno y sociedad civil, general",151,150,Gobierno y sociedad civil
15114,Movilización de los ingresos nacionales,active,"Gobierno y sociedad civil, general",151,150,Gobierno y sociedad civil
15125,Contratación pública,active,"Gobierno y sociedad civil, general",151,150,Gobierno y sociedad civil
15130,Desarrollo jurídico y judicial,active,"Gobierno y sociedad civil, general",151,150,Gobierno y sociedad civil
15142,Políticas macroeconómicas,active,"Gobierno y sociedad civil, general",151,150,Gobierno y sociedad civil
15150,Participación democrática y sociedad civil,active,"Gobierno y sociedad civil, general",151,150,Gobierno y sociedad civil
15151,Elecciones,active,"Gobierno y sociedad civil, general",151,150,Gobierno y sociedad civil
15152,Órganos legislativos y partidos políticos,active,"Gobierno y sociedad civil, general",151,150,Gobierno y sociedad civil
15153,Medios de comunicación y libre circulación de la información,active,"Gobierno y sociedad civil, general",151,150,Gobierno y sociedad civil
15160,Derechos humanos,active,"Gobierno y sociedad civil, general",151,150,Gobierno y sociedad civil
15170,"Organizaciones y movimientos, e instituciones gubernamentales, en defensa de los derechos de la mujer",active,"Gobierno y sociedad civil, general",151,150,Gobierno y sociedad civil
15180,Eliminación de la violencia contra las mujeres y las niñas,active,"Gobierno y sociedad civil, general",151,150,Gobierno y sociedad civil
15190,"Facilitación de la migración y la movilidad de forma ordenada, segura, regular y responsable",active,"Gobierno y sociedad civil, general",151,150,Gobierno y sociedad civil
15210,Gestión y reforma del sistema de seguridad,active,"Prevención y resolución de conflictos, paz y seguridad",152,150,Gobierno y sociedad civil
15220,Capacidad civil de prevención y resolución de conflictos y de consolidación de la paz,active,"Prevención y resolución de conflictos, paz y seguridad",152,150,Gobierno y sociedad civil
15230,Participación en operaciones internacionales de mantenimiento de la paz,active,"Prevención y resolución de conflictos, paz y seguridad",152,150,Gobierno y sociedad civil
15240,Reintegración y control de armas pequeñas y armas ligeras (APAL),active,"Prevención y resolución de conflictos, paz y seguridad",152,150,Gobierno y sociedad civil
15250,Remoción de minas terrestres y restos explosivos de guerra,active,"Prevención y resolución de conflictos, paz y seguridad",152,150,Gobierno y sociedad civil
15261,Niños soldados (prevención y desmovilización),active,"Prevención y resolución de conflictos, paz y seguridad",152,150,Gobierno y sociedad civil
16010,Protección social,active,Otros servicios e infraestructuras sociales,160,160,Otros servicios e infraestructuras sociales
16020,Creación de empleo,active,Otros servicios e infraestructuras sociales,160,160,Otros servicios e infraestructuras sociales
16030,Gestión administrativa y políticas de la vivienda,active,Otros servicios e infraestructuras sociales,160,160,Otros servicios e infraestructuras sociales
16040,Viviendas de bajo costo,active,Otros servicios e infraestructuras sociales,160,160,Otros servicios e infraestructuras sociales
16050,Ayuda multisectorial para servicios sociales básicos,active,Otros servicios e infraestructuras sociales,160,160,Otros servicios e infraestructuras sociales
16061,Cultura y actividades recreativas,active,Otros servicios e infraestructuras sociales,160,160,Otros servicios e infraestructuras sociales
16062,Creación de capacidades estadísticas,active,Otros servicios e infraestructuras sociales,160,160,Otros servicios e infraestructuras sociales
16063,Lucha contra los estupefacientes,active,Otros servicios e infraestructuras sociales,160,160,Otros servicios e infraestructuras sociales
16064,Mitigación social del VIH/sida,active,Otros servicios e infraestructuras sociales,160,160,Otros servicios e infraestructuras sociales
16070,Derechos laborales,active,Otros servicios e infraestructuras sociales,160,160,Otros servicios e infraestructuras sociales
16080,Diálogo social,active,Otros servicios e infraestructuras sociales,160,160,Otros servicios e infraestructuras sociales
21010,Gestión administrativa y políticas del transporte,active,Transporte y almacenamiento,210,210,Transporte y almacenamiento
21020,Transporte por carretera,active,Transporte y almacenamiento,210,210,Transporte y almacenamiento
21030,Transporte por ferrocarril,active,Transporte y almacenamiento,210,210,Transporte y almacenamiento
21040,Transporte por agua,active,Transporte y almacenamiento,210,210,Transporte y almacenamiento
21050,Transporte aéreo,active,Transporte y almacenamiento,210,210,Transporte y almacenamiento
21061,Almacenamiento,active,Transporte y almacenamiento,210,210,Transporte y almacenamiento
21081,Educación y capacitación en transporte y almacenamiento,active,Transporte y almacenamiento,210,210,Transporte y almacenamiento
22010,Gestión administrativa y políticas de las comunicaciones,active,Comunicaciones,220,220,Comunicaciones
22020,Telecomunicaciones,active,Comunicaciones,220,220,Comunicaciones
22030,"Medios de radio, televisión y prensa escrita",active,Comunicaciones,220,220,Comunicaciones
22040,Tecnología de la información y las comunicaciones (TIC),active,Comunicaciones,220,220,Comunicaciones
23110,Gestión administrativa y políticas de la energía,active,Política energética,231,230,Energía
23181,Educación y capacitación en energía,active,Política energética,231,230,Energía
23182,Investigación sobre la energía,active,Política energética,231,230,Energía
23183,Conservación de la energía y eficiencia desde el punto de vista de la demanda,active,Política energética,231,230,Energía
23210,"Generación de energía, fuentes renovables: múltiples tecnologías",active,"Generación de energía, fuentes renovables",232,230,Energía
23220,Centrales hidroeléctricas,active,"Generación de energía, fuentes renovables",232,230,Energía
23230,Energía solar para redes centralizadas,active,"Generación de energía, fuentes renovables",232,230,Energía
23231,Energía solar para redes aisladas y sistemas autónomos,active,"Generación de energía, fuentes renovables",232,230,Energía
23232,Energía solar: aplicaciones térmicas,active,"Generación de energía, fuentes renovables",232,230,Energía
23240,Energía eólica,active,"Generación de energía, fuentes renovables",232,230,Energía
23250,Energía marina,active,"Generación de energía, fuentes renovables",232,230,Energía
23260,Energía geotérmica,active,"Generación de energía, fuentes renovables",232,230,Energía
23270,Centrales de biocombustibles,active,"Generación de energía, fuentes renovables",232,230,Energía
23310,"Generación de energía, fuentes no renovables, sin especificar",active,"Generación de energía, fuentes no renovables",233,230,Energía
23320,Centrales eléctricas de carbón,active,"Generación de energía, fuentes no renovables",233,230,Energía
23330,Centrales eléctricas de combustible líquido,active,"Generación de energía, fuentes no renovables",233,230,Energía
23340,Centrales eléctricas de gas natural,active,"Generación de energía, fuentes no renovables",233,230,Energía
23350,Centrales eléctricas de combustible fósil con captura y almacenamiento de carbono,active,"Generación de energía, fuentes no renovables",233,230,Energía
23360,Centrales eléctricas de residuos no renovables,active,"Generación de energía, fuentes no renovables",233,230,Energía
23410,Centrales eléctricas de energía híbrida,active,Centrales de energía híbrida,234,230,Energía
23510,Centrales eléctricas de energía nuclear y seguridad nuclear,active,Centrales de energía nuclear,235,230,Energía
23610,Centrales de producción de calor,active,Distribución de la energía,236,230,Energía
23620,Calefacción y refrigeración urbanas,active,Distribución de la energía,236,230,Energía
23630,Transmisión y distribución de energía eléctrica (redes centralizadas),active,Distribución de la energía,236,230,Energía
23631,Transmisión y distribución de energía eléctrica (minirredes aisladas),active,Distribución de la energía,236,230,Energía
23640,Distribución de gas al por menor,active,Distribución de la energía,236,230,Energía
23641,Distribución de combustibles fósiles líquidos o sólidos al por menor,active,Distribución de la energía,236,230,Energía
23642,Infraestructuras para la movilidad eléctrica,active,Distribución de la energía,236,230,Energía
24010,Gestión administrativa y políticas financieras,active,Servicios bancarios y financieros,240,240,Servicios bancarios y financieros
24020,Instituciones financieras,active,Servicios bancarios y financieros,240,240,Servicios bancarios y financieros
24030,Intermediarios financieros del sector formal,active,Servicios bancarios y financieros,240,240,Servicios bancarios y financieros
24040,Intermediarios financieros formales o semiformales,active,Servicios bancarios y financieros,240,240,Servicios bancarios y financieros
24050,"Facilitación, promoción y optimización de remesas",active,Servicios bancarios y financieros,240,240,Servicios bancarios y financieros
24081,Educación o capacitación en servicios bancarios y financieros,active,Servicios bancarios y financieros,240,240,Servicios bancarios y financieros
25010,Políticas y administración empresariales,active,Empresas y otros servicios,250,250,Empresas y otros servicios
25020,Privatización,active,Empresas y otros servicios,250,250,Empresas y otros servicios
25030,Servicios de desarrollo empresarial,active,Empresas y otros servicios,250,250,Empresas y otros servicios
25040,Conducta empresarial responsable,active,Empresas y otros servicios,250,250,Empresas y otros servicios
31110,Gestión administrativa y políticas agrícolas,active,Agricultura,311,310,"Agricultura, Silvicultura, Pesca"
31120,Desarrollo agrícola,active,Agricultura,311,310,"Agricultura, Silvicultura, Pesca"
31130,Recursos agrícolas terrestres,active,Agricultura,311,310,"Agricultura, Silvicultura, Pesca"
31140,Recursos agrícolas hídricos,active,Agricultura,311,310,"Agricultura, Silvicultura, Pesca"
31150,Insumos agrícolas,active,Agricultura,311,310,"Agricultura, Silvicultura, Pesca"
31161,Producción de cultivos alimentarios,active,Agricultura,311,310,"Agricultura, Silvicultura, Pesca"
31162,Cultivos industriales o de exportación,active,Agricultura,311,310,"Agricultura, Silvicultura, Pesca"
31163,Ganadería,active,Agricultura,311,310,"Agricultura, Silvicultura, Pesca"
31164,Reforma agraria,active,Agricultura,311,310,"Agricultura, Silvicultura, Pesca"
31165,Desarrollo de alternativas agrícolas,active,Agricultura,311,310,"Agricultura, Silvicultura, Pesca"
31166,Extensión agrícola,active,Agricultura,311,310,"Agricultura, Silvicultura, Pesca"
31181,Educación o capacitación agrícola,active,Agricultura,311,310,"Agricultura, Silvicultura, Pesca"
31182,Investigación agrícola,active,Agricultura,311,310,"Agricultura, Silvicultura, Pesca"
31191,Servicios agrícolas,active,Agricultura,311,310,"Agricultura, Silvicultura, Pesca"
31192,Protección y lucha contra las plagas de plantas y poscosecha,active,Agricultura,311,310,"Agricultura, Silvicultura, Pesca"
31193,Servicios financieros agrícolas,active,Agricultura,311,310,"Agricultura, Silvicultura, Pesca"
31194,Cooperativas agrícolas,active,Agricultura,311,310,"Agricultura, Silvicultura, Pesca"
31195,Servicios ganaderos o veterinarios,active,Agricultura,311,310,"Agricultura, Silvicultura, Pesca"
31210,Gestión administrativa y políticas forestales,active,Silvicultura,312,310,"Agricultura, Silvicultura, Pesca"
31220,Desarrollo forestal,active,Silvicultura,312,310,"Agricultura, Silvicultura, Pesca"
31261,Leña o carbón vegetal,active,Silvicultura,312,310,"Agricultura, Silvicultura, Pesca"
31281,Educación y capacitación en silvicultura,active,Silvicultura,312,310,"Agricultura, Silvicultura, Pesca"
31282,Investigación sobre silvicultura,active,Silvicultura,312,310,"Agricultura, Silvicultura, Pesca"
31291,Servicios relacionados con la silvicultura,active,Silvicultura,312,310,"Agricultura, Silvicultura, Pesca"
31310,Gestión administrativa y políticas pesqueras,active,Pesca,313,310,"Agricultura, Silvicultura, Pesca"
31320,Desarrollo pesquero,active,Pesca,313,310,"Agricultura, Silvicultura, Pesca"
31381,Educación o capacitación en pesca,active,Pesca,313,310,"Agricultura, Silvicultura, Pesca"
31382,Investigación sobre pesca,active,Pesca,313,310,"Agricultura, Silvicultura, Pesca"
31391,Servicios pesqueros,active,Pesca,313,310,"Agricultura, Silvicultura, Pesca"
32110,Gestión administrativa y políticas industriales,active,Industria,321,320,"Industria, extractivas, construcción"
32120,Desarrollo industrial,active,Industria,321,320,"Industria, extractivas, construcción"
32130,Desarrollo de pequeñas y medianas empresas (pymes),active,Industria,321,320,"Industria, extractivas, construcción"
32140,Industria familiar y artesanía,active,Industria,321,320,"Industria, extractivas, construcción"
32161,Agroindustrias,active,Industria,321,320,"Industria, extractivas, construcción"
32162,Industrias forestales,active,Industria,321,320,"Industria, extractivas, construcción"
32163,"Textiles, cuero y sustitutos",active,Industria,321,320,"Industria, extractivas, construcción"
32164,Químicos,active,Industria,321,320,"Industria, extractivas, construcción"
32165,Plantas de fertilizantes,active,Industria,321,320,"Industria, extractivas, construcción"
32166,"Cemento, cal o yeso",active,Industria,321,320,"Industria, extractivas, construcción"
32167,Producción de energía (combustibles fósiles),active,Industria,321,320,"Industria, extractivas, construcción"
32168,Producción farmacéutica,active,Industria,321,320,"Industria, extractivas, construcción"
32169,Industrias metalúrgicas básicas,active,Industria,321,320,"Industria, extractivas, construcción"
32170,Industrias de metales no-ferrosos,active,Industria,321,320,"Industria, extractivas, construcción"
32171,Ingeniería,active,Industria,321,320,"Industria, extractivas, construcción"
32172,Industria de equipos de transporte,active,Industria,321,320,"Industria, extractivas, construcción"
32173,Producción de biocombustibles modernos,active,Industria,321,320,"Industria, extractivas, construcción"
32174,Fabricación de equipos de cocina no contaminantes,active,Industria,321,320,"Industria, extractivas, construcción"
32182,Investigación y desarrollo tecnológicos,active,Industria,321,320,"Industria, extractivas, construcción"
32210,Gestión administrativa y políticas mineras o minerales,active,Industrias extractivas,322,320,"Industria, extractivas, construcción"
32220,Prospección y exploración de minerales,active,Industrias extractivas,322,320,"Industria, extractivas, construcción"
32261,Carbón,active,Industrias extractivas,322,320,"Industria, extractivas, construcción"
32262,Petróleo y gas (exploración y producción),active,Industrias extractivas,322,320,"Industria, extractivas, construcción"
32263,Metales ferrosos,active,Industrias extractivas,322,320,"Industria, extractivas, construcción"
32264,Metales no ferrosos,active,Industrias extractivas,322,320,"Industria, extractivas, construcción"
32265,Metales o materiales preciosos,active,Industrias extractivas,322,320,"Industria, extractivas, construcción"
32266,Minerales industriales,active,Industrias extractivas,322,320,"Industria, extractivas, construcción"
32267,Minerales fertilizantes,active,Industrias extractivas,322,320,"Industria, extractivas, construcción"
32268,Minerales mar adentro,active,Industrias extractivas,322,320,"Industria, extractivas, construcción"
32310,Gestión administrativa y políticas de la construcción,active,Construcción,323,320,"Industria, extractivas, construcción"
33110,Gestión administrativa y políticas del comercio,active,Política y regulación comercial,331,331,Política y regulación comercial
33120,Facilitación del comercio,active,Política y regulación comercial,331,331,Política y regulación comercial
33130,Acuerdos comerciales regionales,active,Política y regulación comercial,331,331,Política y regulación comercial
33140,Negociaciones comerciales multilaterales,active,Política y regulación comercial,331,331,Política y regulación comercial
33150,Ajustes relacionados con el comercio,active,Política y regulación comercial,331,331,Política y regulación comercial
33181,Educación o capacitación en comercio,active,Política y regulación comercial,331,331,Política y regulación comercial
33210,Gestión administrativa y políticas del turismo,active,Turismo,332,332,Turismo
41010,Gestión administrativa y políticas del medio ambiente,active,Protección general medio ambiente,410,410,Protección general medio ambiente
41020,Protección de la biosfera,active,Protección general medio ambiente,410,410,Protección general medio ambiente
41030,Biodiversidad,active,Protección general medio ambiente,410,410,Protección general medio ambiente
41040,Conservación de lugares,active,Protección general medio ambiente,410,410,Protección general medio ambiente
41081,Educación o capacitación ambiental,active,Protección general medio ambiente,410,410,Protección general medio ambiente
41082,Investigación ambiental,active,Protección general medio ambiente,410,410,Protección general medio ambiente
43010,Asistencia multisectorial,active,Otras acciones multisectoriales,430,430,Otras acciones multisectoriales
43030,Desarrollo y administración urbanos,active,Otras acciones multisectoriales,430,430,Otras acciones multisectoriales
43040,Desarrollo rural,active,Otras acciones multisectoriales,430,430,Otras acciones multisectoriales
43050,Desarrollo de alternativas no agrícolas,active,Otras acciones multisectoriales,430,430,Otras acciones multisectoriales
43060,Reducción del riesgo de desastres,active,Otras acciones multisectoriales,430,430,Otras acciones multisectoriales
43071,Gestión administrativa y políticas de la seguridad alimentaria,active,Otras acciones multisectoriales,430,430,Otras acciones multisectoriales
43072,Programas de seguridad alimentaria familiar,active,Otras acciones multisectoriales,430,430,Otras acciones multisectoriales
43073,Inocuidad y calidad alimentarias,active,Otras acciones multisectoriales,430,430,Otras acciones multisectoriales
43081,Educación o capacitación multisectorial,active,Otras acciones multisectoriales,430,430,Otras acciones multisectoriales
43082,Instituciones científicas o de investigación,active,Otras acciones multisectoriales,430,430,Otras acciones multisectoriales
51010,Asistencia relacionada con el apoyo presupuestario general,active,Apoyo presupuestario general,510,510,Apoyo presupuestario general
52010,Asistencia alimentaria,active,Ayuda alimentaria para el desarrollo,520,520,Ayuda alimentaria para el desarrollo
53030,Apoyo a importaciones (bienes de capital),active,Otras ayudas en forma de suministro de bienes,530,530,Otras ayudas en forma de suministro de bienes
53040,Apoyo a importaciones (productos básicos),active,Otras ayudas en forma de suministro de bienes,530,530,Otras ayudas en forma de suministro de bienes
60010,Acciones relativas a la deuda,active,Actividades relacionadas con la deuda,600,600,Actividades relacionadas con la deuda
60020,Condonación de la deuda,active,Actividades relacionadas con la deuda,600,600,Actividades relacionadas con la deuda
60030,Alivio de la deuda multilateral,active,Actividades relacionadas con la deuda,600,600,Actividades relacionadas con la deuda
