code,name,status,codeforiati:category-name,codeforiati:category-code,codeforiati:group-code,codeforiati:group-name
60040,Reprogramación y refinanciación,active,Actividades relacionadas con la deuda,600,600,Actividades relacionadas con la deuda
60061,Canje de deuda por proyectos de desarrollo,active,Actividades relacionadas con la deuda,600,600,Actividades relacionadas con la deuda
60062,Otros canjes de deuda,active,Actividades relacionadas con la deuda,600,600,Actividades relacionadas con la deuda
60063,Recompra de deuda,active,Actividades relacionadas con la deuda,600,600,Actividades relacionadas con la deuda
72010,Asistencia y servicios de socorro material,active,Ayuda de emergencia,720,720,Ayuda de emergencia
72040,Asistencia alimentaria en emergencias,active,Ayuda de emergencia,720,720,Ayuda de emergencia
72050,Servicios de apoyo y coordinación del socorro,active,Ayuda de emergencia,720,720,Ayuda de emergencia
73010,Reconstrucción y rehabilitación inmediata posemergencias,active,Ayuda a la reconstrucción y a la rehabilitación,730,730,Ayuda a la reconstrucción y a la rehabilitación
74020,Preparación de respuesta multirriesgos,active,Prevención de desastres,740,740,Prevención de desastres
91010,Costos administrativos (no asignable por sectores),active,Costes administrativos donantes,910,910,Costes administrativos donantes
93010,Refugiados o solicitantes de asilo en países donantes (no asignable por sectores),active,Ayuda a refugiados en el país donante,930,930,Ayuda a refugiados en el país donante
99810,Sectores no especificados,active,Sin especificación / no clasificados,998,998,Sin especificación / no clasificados
99820,Sensibilización sobre el desarrollo (no asignable por sectores),active,Sin especificación / no clasificados,998,998,Sin especificación / no clasificados
