code,name,status,codeforiati:group-code,codeforiati:group-name,codeforiati:category-code,codeforiati:category-name
11110,Gestión administrativa y políticas de la educación,active,110,Educación,111,"Educación, nivel no especificado"
11120,Instalaciones educativas y capacitación,active,110,Educación,111,"Educación, nivel no especificado"
11130,Capacitación de docentes,active,110,Educación,111,"Educación, nivel no especificado"
11182,Investigación educativa,active,110,Educación,111,"Educación, nivel no especificado"
11220,Educación primaria,active,110,Educación,112,Educación básica
11230,Competencias básicas para la vida dirigidas a adultos,active,110,Educación,112,Educación básica
11231,Competencias básicas para la vida dirigidas a jóvenes,active,110,Educación,112,Educación básica
11232,Equivalente a la educación primaria para adultos,active,110,Educación,112,Educación básica
11240,Educación de la primera infancia,active,110,Educación,112,Educación básica
11250,Alimentación escolar,active,110,Educación,112,Educación básica
11260,Educación secundaria inferior,active,110,Educación,112,Educación básica
11320,"Educación secundaria superior (modificada, incluye datos de 11322)",active,110,Educación,113,Educación secundaria
11330,Capacitación profesional,active,110,Educación,113,Educación secundaria
11420,Educación superior,active,110,Educación,114,Educación post-secundaria
11430,Capacitación técnica y administrativa avanzada,active,110,Educación,114,Educación post-secundaria
12110,Gestión administrativa y políticas de la salud,active,120,Salud,121,"Salud, general"
12181,Educación o capacitación médica,active,120,Salud,121,"Salud, general"
12182,Investigación médica,active,120,Salud,121,"Salud, general"
12191,Servicios médicos,active,120,Salud,121,"Salud, general"
12220,Atención sanitaria básica,active,120,Salud,122,Salud básica
12230,Infraestructura de la salud básica,active,120,Salud,122,Salud básica
12240,Nutrición básica,active,120,Salud,122,Salud básica
12250,Lucha contra las enfermedades infecciosas,active,120,Salud,122,Salud básica
12261,Educación sanitaria,active,120,Salud,122,Salud básica
12262,Lucha contra el paludismo,active,120,Salud,122,Salud básica
12263,Lucha contra tuberculosis,active,120,Salud,122,Salud básica
12264,,active,120,Salud,122,Salud básica
12281,Desarrollo del personal sanitario,active,120,Salud,122,Salud básica
12310,"Lucha contra enfermedades no transmisibles, general",active,120,Salud,123,Enfermedades no transmisibles
12320,Lucha contra el tabaquismo,active,120,Salud,123,Enfermedades no transmisibles
12330,Lucha contra el consumo nocivo de alcohol y drogas,active,120,Salud,123,Enfermedades no transmisibles
12340,Fomento de la salud y el bienestar mentales,active,120,Salud,123,Enfermedades no transmisibles
12350,Otro tipo de prevenciones y tratamientos de enfermedades no transmisibles,active,120,Salud,123,Enfermedades no transmisibles
12382,Investigación en prevención de y lucha contra enfermedades no transmisibles,active,120,Salud,123,Enfermedades no transmisibles
13010,Gestión administrativa y políticas en materia demográfica,active,130,Programas/políticas sobre población y salud reproductiva,130,Programas/políticas sobre población y salud reproductiva
13020,Atención de la salud reproductiva,active,130,Programas/políticas sobre población y salud reproductiva,130,Programas/políticas sobre población y salud reproductiva
13030,Planificación familiar,active,130,Programas/políticas sobre población y salud reproductiva,130,Programas/políticas sobre población y salud reproductiva
13040,"Lucha contra enfermedades de transmisión sexual, incluido el VIH/sida",active,130,Programas/políticas sobre población y salud reproductiva,130,Programas/políticas sobre población y salud reproductiva
13081,Desarrollo del personal de salud reproductiva y de la población,active,130,Programas/políticas sobre población y salud reproductiva,130,Programas/políticas sobre población y salud reproductiva
14010,Gestión administrativa y políticas del sector del agua,active,140,Abastecimiento de agua y saneamiento,140,Abastecimiento de agua y saneamiento
14015,Conservación de los recursos hídricos (incluida la recogida de datos),active,140,Abastecimiento de agua y saneamiento,140,Abastecimiento de agua y saneamiento
14020,Abastecimiento de agua y saneamiento: grandes sistemas,active,140,Abastecimiento de agua y saneamiento,140,Abastecimiento de agua y saneamiento
14021,Abastecimiento de agua: grandes sistemas,active,140,Abastecimiento de agua y saneamiento,140,Abastecimiento de agua y saneamiento
14022,Saneamiento: grandes sistemas,active,140,Abastecimiento de agua y saneamiento,140,Abastecimiento de agua y saneamiento
14030,Abastecimiento de agua potable y saneamiento básicos,active,140,Abastecimiento de agua y saneamiento,140,Abastecimiento de agua y saneamiento
14031,Abastecimiento básico de agua potable,active,140,Abastecimiento de agua y saneamiento,140,Abastecimiento de agua y saneamiento
14032,Saneamiento básico,active,140,Abastecimiento de agua y saneamiento,140,Abastecimiento de agua y saneamiento
14040,Desarrollo de cuencas fluviales,active,140,Abastecimiento de agua y saneamiento,140,Abastecimiento de agua y saneamiento
14050,Gestión y eliminación de residuos,active,140,Abastecimiento de agua y saneamiento,140,Abastecimiento de agua y saneamiento
14081,Educación y formación en abastecimiento de agua y saneamiento,active,140,Abastecimiento de agua y saneamiento,140,Abastecimiento de agua y saneamiento
15110,Gestión administrativa y políticas del sector público,active,150,Gobierno y sociedad civil,151,"Gobierno y sociedad civil, general"
15111,Gestión financiera pública (GFP),active,150,Gobierno y sociedad civil,151,"Gobierno y sociedad civil, general"
15112,Descentralización y apoyo a gobiernos subnacionales,active,150,Gobierno y sociedad civil,151,"Gobierno y sociedad civil, general"
15113,Instituciones y organizaciones contra la corrupción,active,150,Gobierno y sociedad civil,151,"Gobierno y sociedad civil, general"
15114,Movilización de los ingresos nacionales,active,150,Gobierno y sociedad civil,151,"Gobierno y sociedad civil, general"
15125,Contratación pública,active,150,Gobierno y sociedad civil,151,"Gobierno y sociedad civil, general"
15130,Desarrollo jurídico y judicial,active,150,Gobierno y sociedad civil,151,"Gobierno y sociedad civil, general"
15142,Políticas macroeconómicas,active,150,Gobierno y sociedad civil,151,"Gobierno y sociedad civil, general"
15150,Participación democrática y sociedad civil,active,150,Gobierno y sociedad civil,151,"Gobierno y sociedad civil, general"
15151,Elecciones,active,150,Gobierno y sociedad civil,151,"Gobierno y sociedad civil, general"
15152,Órganos legislativos y partidos políticos,active,150,Gobierno y sociedad civil,151,"Gobierno y sociedad civil, general"
15153,Medios de comunicación y libre circulación de la información,active,150,Gobierno y sociedad civil,151,"Gobierno y sociedad civil, general"
15160,Derechos humanos,active,150,Gobierno y sociedad civil,151,"Gobierno y sociedad civil, general"
15170,"Organizaciones y movimientos, e instituciones gubernamentales, en defensa de los derechos de la mujer",active,150,Gobierno y sociedad civil,151,"Gobierno y sociedad civil, general"
15180,Eliminación de la violencia contra las mujeres y las niñas,active,150,Gobierno y sociedad civil,151,"Gobierno y sociedad civil, general"
15190,"Facilitación de la migración y la movilidad de forma ordenada, segura, regular y responsable",active,150,Gobierno y sociedad civil,151,"Gobierno y sociedad civil, general"
15210,Gestión y reforma del sistema de seguridad,active,150,Gobierno y sociedad civil,152,"Prevención y resolución de conflictos, paz y seguridad"
15220,Capacidad civil de prevención y resolución de conflictos y de consolidación de la paz,active,150,Gobierno y sociedad civil,152,"Prevención y resolución de conflictos, paz y seguridad"
15230,Participación en operaciones internacionales de mantenimiento de la paz,active,150,Gobierno y sociedad civil,152,"Prevención y resolución de conflictos, paz y seguridad"
15240,Reintegración y control de armas pequeñas y armas ligeras (APAL),active,150,Gobierno y sociedad civil,152,"Prevención y resolución de conflictos, paz y seguridad"
15250,Remoción de minas terrestres y restos explosivos de guerra,active,150,Gobierno y sociedad civil,152,"Prevención y resolución de conflictos, paz y seguridad"
15261,Niños soldados (prevención y desmovilización),active,150,Gobierno y sociedad civil,152,"Prevención y resolución de conflictos, paz y seguridad"
16010,Protección social,active,160,Otros servicios e infraestructuras sociales,160,Otros servicios e infraestructuras sociales
16020,Creación de empleo,active,160,Otros servicios e infraestructuras sociales,160,Otros servicios e infraestructuras sociales
16030,Gestión administrativa y políticas de la vivienda,active,160,Otros servicios e infraestructuras sociales,160,Otros servicios e infraestructuras sociales
16040,Viviendas de bajo costo,active,160,Otros servicios e infraestructuras sociales,160,Otros servicios e infraestructuras sociales
16050,Ayuda multisectorial para servicios sociales básicos,active,160,Otros servicios e infraestructuras sociales,160,Otros servicios e infraestructuras sociales
16061,Cultura y actividades recreativas,active,160,Otros servicios e infraestructuras sociales,160,Otros servicios e infraestructuras sociales
16062,Creación de capacidades estadísticas,active,160,Otros servicios e infraestructuras sociales,160,Otros servicios e infraestructuras sociales
16063,Lucha contra los estupefacientes,active,160,Otros servicios e infraestructuras sociales,160,Otros servicios e infraestructuras sociales
16064,Mitigación social del VIH/sida,active,160,Otros servicios e infraestructuras sociales,160,Otros servicios e infraestructuras sociales
16070,Derechos laborales,active,160,Otros servicios e infraestructuras sociales,160,Otros servicios e infraestructuras sociales
16080,Diálogo social,active,160,Otros servicios e infraestructuras sociales,160,Otros servicios e infraestructuras sociales
21010,Gestión administrativa y políticas del transporte,active,210,Transporte y almacenamiento,210,Transporte y almacenamiento
21020,Transporte por carretera,active,210,Transporte y almacenamiento,210,Transporte y almacenamiento
21030,Transporte por ferrocarril,active,210,Transporte y almacenamiento,210,Transporte y almacenamiento
21040,Transporte por agua,active,210,Transporte y almacenamiento,210,Transporte y almacenamiento
21050,Transporte aéreo,active,210,Transporte y almacenamiento,210,Transporte y almacenamiento
21061,Almacenamiento,active,210,Transporte y almacenamiento,210,Transporte y almacenamiento
21081,Educación y capacitación en transporte y almacenamiento,active,210,Transporte y almacenamiento,210,Transporte y almacenamiento
22010,Gestión administrativa y políticas de las comunicaciones,active,220,Comunicaciones,220,Comunicaciones
22020,Telecomunicaciones,active,220,Comunicaciones,220,Comunicaciones
22030,"Medios de radio, televisión y prensa escrita",active,220,Comunicaciones,220,Comunicaciones
22040,Tecnología de la información y las comunicaciones (TIC),active,220,Comunicaciones,220,Comunicaciones
23110,Gestión administrativa y políticas de la energía,active,230,Energía,231,Política energética
23181,Educación y capacitación en energía,active,230,Energía,231,Política energética
23182,Investigación sobre la energía,active,230,Energía,231,Política energética
23183,Conservación de la energía y eficiencia desde el punto de vista de la demanda,active,230,Energía,231,Política energética
23210,"Generación de energía, fuentes renovables: múltiples tecnologías",active,230,Energía,232,"Generación de energía, fuentes renovables"
23220,Centrales hidroeléctricas,active,230,Energía,232,"Generación de energía, fuentes renovables"
23230,Energía solar para redes centralizadas,active,230,Energía,232,"Generación de energía, fuentes renovables"
23231,Energía solar para redes aisladas y sistemas autónomos,active,230,Energía,232,"Generación de energía, fuentes renovables"
23232,Energía solar: aplicaciones térmicas,active,230,Energía,232,"Generación de energía, fuentes renovables"
23240,Energía eólica,active,230,Energía,232,"Generación de energía, fuentes renovables"
23250,Energía marina,active,230,Energía,232,"Generación de energía, fuentes renovables"
23260,Energía geotérmica,active,230,Energía,232,"Generación de energía, fuentes renovables"
23270,Centrales de biocombustibles,active,230,Energía,232,"Generación de energía, fuentes renovables"
23310,"Generación de energía, fuentes no renovables, sin especificar",active,230,Energía,233,"Generación de energía, fuentes no renovables"
23320,Centrales eléctricas de carbón,active,230,Energía,233,"Generación de energía, fuentes no renovables"
23330,Centrales eléctricas de combustible líquido,active,230,Energía,233,"Generación de energía, fuentes no renovables"
23340,Centrales eléctricas de gas natural,active,230,Energía,233,"Generación de energía, fuentes no renovables"
23350,Centrales eléctricas de combustible fósil con captura y almacenamiento de carbono,active,230,Energía,233,"Generación de energía, fuentes no renovables"
23360,Centrales eléctricas de residuos no renovables,active,230,Energía,233,"Generación de energía, fuentes no renovables"
23410,Centrales eléctricas de energía híbrida,active,230,Energía,234,Centrales de energía híbrida
23510,Centrales eléctricas de energía nuclear y seguridad nuclear,active,230,Energía,235,Centrales de energía nuclear
23610,Centrales de producción de calor,active,230,Energía,236,Distribución de la energía
23620,Calefacción y refrigeración urbanas,active,230,Energía,236,Distribución de la energía
23630,Transmisión y distribución de energía eléctrica (redes centralizadas),active,230,Energía,236,Distribución de la energía
23631,Transmisión y distribución de energía eléctrica (minirredes aisladas),active,230,Energía,236,Distribución de la energía
23640,Distribución de gas al por menor,active,230,Energía,236,Distribución de la energía
23641,Distribución de combustibles fósiles líquidos o sólidos al por menor,active,230,Energía,236,Distribución de la energía
23642,Infraestructuras para la movilidad eléctrica,active,230,Energía,236,Distribución de la energía
24010,Gestión administrativa y políticas financieras,active,240,Servicios bancarios y financieros,240,Servicios bancarios y financieros
24020,Instituciones financieras,active,240,Servicios bancarios y financieros,240,Servicios bancarios y financieros
24030,Intermediarios financieros del sector formal,active,240,Servicios bancarios y financieros,240,Servicios bancarios y financieros
24040,Intermediarios financieros formales o semiformales,active,240,Servicios bancarios y financieros,240,Servicios bancarios y financieros
24050,"Facilitación, promoción y optimización de remesas",active,240,Servicios bancarios y financieros,240,Servicios bancarios y financieros
24081,Educación o capacitación en servicios bancarios y financieros,active,240,Servicios bancarios y financieros,240,Servicios bancarios y financieros
25010,Políticas y administración empresariales,active,250,Empresas y otros servicios,250,Empresas y otros servicios
25020,Privatización,active,250,Empresas y otros servicios,250,Empresas y otros servicios
25030,Servicios de desarrollo empresarial,active,250,Empresas y otros servicios,250,Empresas y otros servicios
25040,Conducta empresarial responsable,active,250,Empresas y otros servicios,250,Empresas y otros servicios
31110,Gestión administrativa y políticas agrícolas,active,310,"Agricultura, Silvicultura, Pesca",311,Agricultura
31120,Desarrollo agrícola,active,310,"Agricultura, Silvicultura, Pesca",311,Agricultura
31130,Recursos agrícolas terrestres,active,310,"Agricultura, Silvicultura, Pesca",311,Agricultura
31140,Recursos agrícolas hídricos,active,310,"Agricultura, Silvicultura, Pesca",311,Agricultura
31150,Insumos agrícolas,active,310,"Agricultura, Silvicultura, Pesca",311,Agricultura
31161,Producción de cultivos alimentarios,active,310,"Agricultura, Silvicultura, Pesca",311,Agricultura
31162,Cultivos industriales o de exportación,active,310,"Agricultura, Silvicultura, Pesca",311,Agricultura
31163,Ganadería,active,310,"Agricultura, Silvicultura, Pesca",311,Agricultura
31164,Reforma agraria,active,310,"Agricultura, Silvicultura, Pesca",311,Agricultura
31165,Desarrollo de alternativas agrícolas,active,310,"Agricultura, Silvicultura, Pesca",311,Agricultura
31166,Extensión agrícola,active,310,"Agricultura, Silvicultura, Pesca",311,Agricultura
31181,Educación o capacitación agrícola,active,310,"Agricultura, Silvicultura, Pesca",311,Agricultura
31182,Investigación agrícola,active,310,"Agricultura, Silvicultura, Pesca",311,Agricultura
31191,Servicios agrícolas,active,310,"Agricultura, Silvicultura, Pesca",311,Agricultura
31192,Protección y lucha contra las plagas de plantas y poscosecha,active,310,"Agricultura, Silvicultura, Pesca",311,Agricultura
31193,Servicios financieros agrícolas,active,310,"Agricultura, Silvicultura, Pesca",311,Agricultura
31194,Cooperativas agrícolas,active,310,"Agricultura, Silvicultura, Pesca",311,Agricultura
31195,Servicios ganaderos o veterinarios,active,310,"Agricultura, Silvicultura, Pesca",311,Agricultura
31210,Gestión administrativa y políticas forestales,active,310,"Agricultura, Silvicultura, Pesca",312,Silvicultura
31220,Desarrollo forestal,active,310,"Agricultura, Silvicultura, Pesca",312,Silvicultura
31261,Leña o carbón vegetal,active,310,"Agricultura, Silvicultura, Pesca",312,Silvicultura
31281,Educación y capacitación en silvicultura,active,310,"Agricultura, Silvicultura, Pesca",312,Silvicultura
31282,Investigación sobre silvicultura,active,310,"Agricultura, Silvicultura, Pesca",312,Silvicultura
31291,Servicios relacionados con la silvicultura,active,310,"Agricultura, Silvicultura, Pesca",312,Silvicultura
31310,Gestión administrativa y políticas pesqueras,active,310,"Agricultura, Silvicultura, Pesca",313,Pesca
31320,Desarrollo pesquero,active,310,"Agricultura, Silvicultura, Pesca",313,Pesca
31381,Educación o capacitación en pesca,active,310,"Agricultura, Silvicultura, Pesca",313,Pesca
31382,Investigación sobre pesca,active,310,"Agricultura, Silvicultura, Pesca",313,Pesca
31391,Servicios pesqueros,active,310,"Agricultura, Silvicultura, Pesca",313,Pesca
32110,Gestión administrativa y políticas industriales,active,320,"Industria, extractivas, construcción",321,Industria
32120,Desarrollo industrial,active,320,"Industria, extractivas, construcción",321,Industria
32130,Desarrollo de pequeñas y medianas empresas (pymes),active,320,"Industria, extractivas, construcción",321,Industria
32140,Industria familiar y artesanía,active,320,"Industria, extractivas, construcción",321,Industria
32161,Agroindustrias,active,320,"Industria, extractivas, construcción",321,Industria
32162,Industrias forestales,active,320,"Industria, extractivas, construcción",321,Industria
32163,"Textiles, cuero y sustitutos",active,320,"Industria, extractivas, construcción",321,Industria
32164,Químicos,active,320,"Industria, extractivas, construcción",321,Industria
32165,Plantas de fertilizantes,active,320,"Industria, extractivas, construcción",321,Industria
32166,"Cemento, cal o yeso",active,320,"Industria, extractivas, construcción",321,Industria
32167,Producción de energía (combustibles fósiles),active,320,"Industria, extractivas, construcción",321,Industria
32168,Producción farmacéutica,active,320,"Industria, extractivas, construcción",321,Industria
32169,Industrias metalúrgicas básicas,active,320,"Industria, extractivas, construcción",321,Industria
32170,Industrias de metales no-ferrosos,active,320,"Industria, extractivas, construcción",321,Industria
32171,Ingeniería,active,320,"Industria, extractivas, construcción",321,Industria
32172,Industria de equipos de transporte,active,320,"Industria, extractivas, construcción",321,Industria
32173,Producción de biocombustibles modernos,active,320,"Industria, extractivas, construcción",321,Industria
32174,Fabricación de equipos de cocina no contaminantes,active,320,"Industria, extractivas, construcción",321,Industria
32182,Investigación y desarrollo tecnológicos,active,320,"Industria, extractivas, construcción",321,Industria
32210,Gestión administrativa y políticas mineras o minerales,active,320,"Industria, extractivas, construcción",322,Industrias extractivas
32220,Prospección y exploración de minerales,active,320,"Industria, extractivas, construcción",322,Industrias extractivas
32261,Carbón,active,320,"Industria, extractivas, construcción",322,Industrias extractivas
32262,Petróleo y gas (exploración y producción),active,320,"Industria, extractivas, construcción",322,Industrias extractivas
32263,Metales ferrosos,active,320,"Industria, extractivas, construcción",322,Industrias extractivas
32264,Metales no ferrosos,active,320,"Industria, extractivas, construcción",322,Industrias extractivas
32265,Metales o materiales preciosos,active,320,"Industria, extractivas, construcción",322,Industrias extractivas
32266,Minerales industriales,active,320,"Industria, extractivas, construcción",322,Industrias extractivas
32267,Minerales fertilizantes,active,320,"Industria, extractivas, construcción",322,Industrias extractivas
32268,Minerales mar adentro,active,320,"Industria, extractivas, construcción",322,Industrias extractivas
32310,Gestión administrativa y políticas de la construcción,active,320,"Industria, extractivas, construcción",323,Construcción
33110,Gestión administrativa y políticas del comercio,active,331,Política y regulación comercial,331,Política y regulación comercial
33120,Facilitación del comercio,active,331,Política y regulación comercial,331,Política y regulación comercial
33130,Acuerdos comerciales regionales,active,331,Política y regulación comercial,331,Política y regulación comercial
33140,Negociaciones comerciales multilaterales,active,331,Política y regulación comercial,331,Política y regulación comercial
33150,Ajustes relacionados con el comercio,active,331,Política y regulación comercial,331,Política y regulación comercial
33181,Educación o capacitación en comercio,active,331,Política y regulación comercial,331,Política y regulación comercial
33210,Gestión administrativa y políticas del turismo,active,332,Turismo,332,Turismo
41010,Gestión administrativa y políticas del medio ambiente,active,410,Protección general medio ambiente,410,Protección general medio ambiente
41020,Protección de la biosfera,active,410,Protección general medio ambiente,410,Protección general medio ambiente
41030,Biodiversidad,active,410,Protección general medio ambiente,410,Protección general medio ambiente
41040,Conservación de lugares,active,410,Protección general medio ambiente,410,Protección general medio ambiente
41081,Educación o capacitación ambiental,active,410,Protección general medio ambiente,410,Protección general medio ambiente
41082,Investigación ambiental,active,410,Protección general medio ambiente,410,Protección general medio ambiente
43010,Asistencia multisectorial,active,430,Otras acciones multisectoriales,430,Otras acciones multisectoriales
43030,Desarrollo y administración urbanos,active,430,Otras acciones multisectoriales,430,Otras acciones multisectoriales
43040,Desarrollo rural,active,430,Otras acciones multisectoriales,430,Otras acciones multisectoriales
43050,Desarrollo de alternativas no agrícolas,active,430,Otras acciones multisectoriales,430,Otras acciones multisectoriales
43060,Reducción del riesgo de desastres,active,430,Otras acciones multisectoriales,430,Otras acciones multisectoriales
43071,Gestión administrativa y políticas de la seguridad alimentaria,active,430,Otras acciones multisectoriales,430,Otras acciones multisectoriales
43072,Programas de seguridad alimentaria familiar,active,430,Otras acciones multisectoriales,430,Otras acciones multisectoriales
43073,Inocuidad y calidad alimentarias,active,430,Otras acciones multisectoriales,430,Otras acciones multisectoriales
43081,Educación o capacitación multisectorial,active,430,Otras acciones multisectoriales,430,Otras acciones multisectoriales
43082,Instituciones científicas o de investigación,active,430,Otras acciones multisectoriales,430,Otras acciones multisectoriales
51010,Asistencia relacionada con el apoyo presupuestario general,active,510,Apoyo presupuestario general,510,Apoyo presupuestario general
52010,Asistencia alimentaria,active,520,Ayuda alimentaria para el desarrollo,520,Ayuda alimentaria para el desarrollo
53030,Apoyo a importaciones (bienes de capital),active,530,Otras ayudas en forma de suministro de bienes,530,Otras ayudas en forma de suministro de bienes
53040,Apoyo a importaciones (productos básicos),active,530,Otras ayudas en forma de suministro de bienes,530,Otras ayudas en forma de suministro de bienes
60010,Acciones relativas a la deuda,active,600,Actividades relacionadas con la deuda,600,Actividades relacionadas con la deuda
60020,Condonación de la deuda,active,600,Actividades relacionadas con la deuda,600,Actividades relacionadas con la deuda
60030,Alivio de la deuda multilateral,active,600,Actividades relacionadas con la deuda,600,Actividades relacionadas con la deuda
